{
  "campaign_id": "C-dd45a4a369",
  "snapshot_id": "unpinned",
  "backend": "regex",
  "parse_version": "3",
  "created_at": "2026-09-09T03:34:09.622319+00:00",
  "entry_count": 5,
  "nodes": [
    {
      "id": "Rollup.sol#Rollup",
      "kind": "contract",
      "name": "Rollup",
      "path": "Rollup.sol",
      "line": 7,
      "contract_closure": [
        {
          "name": "finalizeBatch",
          "defining_contract": "Rollup",
          "path": "Rollup.sol",
          "line": 11,
          "guards": [
            {
              "line": 12,
              "concept_keys": [
                "batch",
                "batch:index",
                "finalized",
                "finalized:batch",
                "finalized:batch:index",
                "index",
                "last",
                "last:finalized",
                "last:finalized:batch"
              ],
              "class": 0,
              "text": "batchIndex > lastFinalizedBatchIndex"
            }
          ],
          "uses": [
            {
              "line": 12,
              "concept_keys": [
                "batch",
                "batch:index",
                "index"
              ],
              "kind": "param"
            },
            {
              "line": 13,
              "concept_keys": [
                "batch",
                "batch:index",
                "index"
              ],
              "kind": "param"
            },
            {
              "line": 13,
              "concept_keys": [
                "root",
                "state",
                "state:root"
              ],
              "kind": "param"
            },
            {
              "line": 13,
              "concept_keys": [
                "batch",
                "batch:index",
                "batch:roots",
                "index",
                "roots"
              ],
              "kind": "read"
            },
            {
              "line": 13,
              "concept_keys": [
                "batch",
                "batch:index",
                "batch:roots",
                "index",
                "roots"
              ],
              "kind": "write"
            },
            {
              "line": 14,
              "concept_keys": [
                "batch",
                "batch:index",
                "index"
              ],
              "kind": "param"
            },
            {
              "line": 14,
              "concept_keys": [
                "batch",
                "batch:index",
                "finalized",
                "finalized:batch",
                "finalized:batch:index",
                "index",
                "last",
                "last:finalized",
                "last:finalized:batch"
              ],
              "kind": "write"
            }
          ]
        }
      ]
    },
    {
      "id": "Rollup.sol#Rollup.lastFinalizedBatchIndex",
      "kind": "state-variable",
      "name": "lastFinalizedBatchIndex",
      "path": "Rollup.sol",
      "line": null
    },
    {
      "id": "Rollup.sol#Rollup.batchRoots",
      "kind": "state-variable",
      "name": "batchRoots",
      "path": "Rollup.sol",
      "line": null
    },
    {
      "id": "Rollup.sol#Rollup.finalizeBatch",
      "kind": "function",
      "name": "finalizeBatch",
      "path": "Rollup.sol",
      "line": 11,
      "visibility": "external",
      "is_entry_point": true,
      "modifiers": [],
      "guarded_by": [],
      "selector": "finalizeBatch(uint256,bytes32)",
      "reads_storage": [
        "lastFinalizedBatchIndex",
        "batchRoots"
      ],
      "writes_storage": [
        "lastFinalizedBatchIndex"
      ],
      "calls_internal": [],
      "calls_external": [],
      "delegatecalls": [],
      "guards": [
        {
          "line": 12,
          "concept_keys": [
            "batch",
            "batch:index",
            "finalized",
            "finalized:batch",
            "finalized:batch:index",
            "index",
            "last",
            "last:finalized",
            "last:finalized:batch"
          ],
          "class": 0,
          "text": "batchIndex > lastFinalizedBatchIndex"
        }
      ],
      "uses": [
        {
          "line": 12,
          "concept_keys": [
            "batch",
            "batch:index",
            "index"
          ],
          "kind": "param"
        },
        {
          "line": 13,
          "concept_keys": [
            "batch",
            "batch:index",
            "index"
          ],
          "kind": "param"
        },
        {
          "line": 13,
          "concept_keys": [
            "root",
            "state",
            "state:root"
          ],
          "kind": "param"
        },
        {
          "line": 13,
          "concept_keys": [
            "batch",
            "batch:index",
            "batch:roots",
            "index",
            "roots"
          ],
          "kind": "read"
        },
        {
          "line": 13,
          "concept_keys": [
            "batch",
            "batch:index",
            "batch:roots",
            "index",
            "roots"
          ],
          "kind": "write"
        },
        {
          "line": 14,
          "concept_keys": [
            "batch",
            "batch:index",
            "index"
          ],
          "kind": "param"
        },
        {
          "line": 14,
          "concept_keys": [
            "batch",
            "batch:index",
            "finalized",
            "finalized:batch",
            "finalized:batch:index",
            "index",
            "last",
            "last:finalized",
            "last:finalized:batch"
          ],
          "kind": "write"
        }
      ]
    }
  ],
  "edges": [
    {
      "from": "Rollup.sol#Rollup",
      "rel": "extends-interface",
      "to": "Rollup.sol#Rollup.finalizeBatch"
    }
  ],
  "stats": {
    "solidity_files": 1,
    "other_files_listed": 0,
    "contracts": 1,
    "functions": 1,
    "state_variables": 2,
    "entry_points": 1,
    "external_call_edges": 0
  }
}
