{
  "campaign_id": "C-dff9331d84",
  "snapshot_id": "unpinned",
  "backend": "regex",
  "parse_version": "3",
  "created_at": "2026-09-09T03:34:09.547044+00:00",
  "entry_count": 4,
  "nodes": [
    {
      "id": "Rollup.sol#Rollup",
      "kind": "contract",
      "name": "Rollup",
      "path": "Rollup.sol",
      "line": 7,
      "contract_closure": [
        {
          "name": "commitBatch",
          "defining_contract": "Rollup",
          "path": "Rollup.sol",
          "line": 12,
          "guards": [
            {
              "line": 13,
              "concept_keys": [
                "batch",
                "batch:index",
                "index",
                "prev",
                "prev:state",
                "prev:state:root",
                "root",
                "state",
                "state:root"
              ],
              "class": 4,
              "text": "prevStateRoot[batchIndex] == stateRoot"
            }
          ],
          "uses": [
            {
              "line": 13,
              "concept_keys": [
                "batch",
                "batch:index",
                "index"
              ],
              "kind": "param"
            },
            {
              "line": 13,
              "concept_keys": [
                "root",
                "state",
                "state:root"
              ],
              "kind": "param"
            },
            {
              "line": 13,
              "concept_keys": [
                "batch",
                "batch:index",
                "index",
                "prev",
                "prev:state",
                "prev:state:root",
                "root",
                "state",
                "state:root"
              ],
              "kind": "read"
            },
            {
              "line": 14,
              "concept_keys": [
                "batch",
                "batch:index",
                "index"
              ],
              "kind": "param"
            },
            {
              "line": 14,
              "concept_keys": [
                "root",
                "state",
                "state:root"
              ],
              "kind": "param"
            },
            {
              "line": 14,
              "concept_keys": [
                "batch",
                "batch:index",
                "index",
                "prev",
                "prev:state",
                "prev:state:root",
                "root",
                "state",
                "state:root"
              ],
              "kind": "read"
            },
            {
              "line": 14,
              "concept_keys": [
                "batch",
                "batch:index",
                "index",
                "prev",
                "prev:state",
                "prev:state:root",
                "root",
                "state",
                "state:root"
              ],
              "kind": "write"
            },
            {
              "line": 15,
              "concept_keys": [
                "batch",
                "batch:index",
                "index",
                "root",
                "state",
                "state:root"
              ],
              "kind": "emit"
            },
            {
              "line": 15,
              "concept_keys": [
                "batch",
                "batch:index",
                "index"
              ],
              "kind": "param"
            },
            {
              "line": 15,
              "concept_keys": [
                "root",
                "state",
                "state:root"
              ],
              "kind": "param"
            }
          ]
        }
      ]
    },
    {
      "id": "Rollup.sol#Rollup.prevStateRoot",
      "kind": "state-variable",
      "name": "prevStateRoot",
      "path": "Rollup.sol",
      "line": null
    },
    {
      "id": "Rollup.sol#Rollup.commitBatch",
      "kind": "function",
      "name": "commitBatch",
      "path": "Rollup.sol",
      "line": 12,
      "visibility": "external",
      "is_entry_point": true,
      "modifiers": [],
      "guarded_by": [],
      "selector": "commitBatch(uint256,bytes32)",
      "reads_storage": [
        "prevStateRoot"
      ],
      "writes_storage": [],
      "calls_internal": [],
      "calls_external": [],
      "delegatecalls": [],
      "guards": [
        {
          "line": 13,
          "concept_keys": [
            "batch",
            "batch:index",
            "index",
            "prev",
            "prev:state",
            "prev:state:root",
            "root",
            "state",
            "state:root"
          ],
          "class": 4,
          "text": "prevStateRoot[batchIndex] == stateRoot"
        }
      ],
      "uses": [
        {
          "line": 13,
          "concept_keys": [
            "batch",
            "batch:index",
            "index"
          ],
          "kind": "param"
        },
        {
          "line": 13,
          "concept_keys": [
            "root",
            "state",
            "state:root"
          ],
          "kind": "param"
        },
        {
          "line": 13,
          "concept_keys": [
            "batch",
            "batch:index",
            "index",
            "prev",
            "prev:state",
            "prev:state:root",
            "root",
            "state",
            "state:root"
          ],
          "kind": "read"
        },
        {
          "line": 14,
          "concept_keys": [
            "batch",
            "batch:index",
            "index"
          ],
          "kind": "param"
        },
        {
          "line": 14,
          "concept_keys": [
            "root",
            "state",
            "state:root"
          ],
          "kind": "param"
        },
        {
          "line": 14,
          "concept_keys": [
            "batch",
            "batch:index",
            "index",
            "prev",
            "prev:state",
            "prev:state:root",
            "root",
            "state",
            "state:root"
          ],
          "kind": "read"
        },
        {
          "line": 14,
          "concept_keys": [
            "batch",
            "batch:index",
            "index",
            "prev",
            "prev:state",
            "prev:state:root",
            "root",
            "state",
            "state:root"
          ],
          "kind": "write"
        },
        {
          "line": 15,
          "concept_keys": [
            "batch",
            "batch:index",
            "index",
            "root",
            "state",
            "state:root"
          ],
          "kind": "emit"
        },
        {
          "line": 15,
          "concept_keys": [
            "batch",
            "batch:index",
            "index"
          ],
          "kind": "param"
        },
        {
          "line": 15,
          "concept_keys": [
            "root",
            "state",
            "state:root"
          ],
          "kind": "param"
        }
      ]
    }
  ],
  "edges": [
    {
      "from": "Rollup.sol#Rollup",
      "rel": "extends-interface",
      "to": "Rollup.sol#Rollup.commitBatch"
    }
  ],
  "stats": {
    "solidity_files": 1,
    "other_files_listed": 0,
    "contracts": 1,
    "functions": 1,
    "state_variables": 1,
    "entry_points": 1,
    "external_call_edges": 0
  }
}
