{
  "campaign_id": "C-e63fd5c096",
  "snapshot_id": "unpinned",
  "backend": "regex",
  "parse_version": "3",
  "created_at": "2026-09-09T03:34:09.597134+00:00",
  "entry_count": 13,
  "nodes": [
    {
      "id": "L1ERC20Gateway.sol#IERC20Upgradeable",
      "kind": "interface",
      "name": "IERC20Upgradeable",
      "path": "L1ERC20Gateway.sol",
      "line": 4,
      "contract_closure": []
    },
    {
      "id": "L1ERC20Gateway.sol#IMorphERC20Upgradeable",
      "kind": "interface",
      "name": "IMorphERC20Upgradeable",
      "path": "L1ERC20Gateway.sol",
      "line": 9,
      "contract_closure": []
    },
    {
      "id": "L1ERC20Gateway.sol#L1ERC20Gateway",
      "kind": "contract",
      "name": "L1ERC20Gateway",
      "path": "L1ERC20Gateway.sol",
      "line": 18,
      "contract_closure": [
        {
          "name": "onDropMessage",
          "defining_contract": "L1ERC20Gateway",
          "path": "L1ERC20Gateway.sol",
          "line": 23,
          "guards": [],
          "uses": [
            {
              "line": 24,
              "concept_keys": [
                "amount"
              ],
              "kind": "param"
            },
            {
              "line": 24,
              "concept_keys": [
                "to"
              ],
              "kind": "param"
            },
            {
              "line": 25,
              "concept_keys": [
                "amount",
                "to"
              ],
              "kind": "emit"
            },
            {
              "line": 25,
              "concept_keys": [
                "amount"
              ],
              "kind": "param"
            },
            {
              "line": 25,
              "concept_keys": [
                "to"
              ],
              "kind": "param"
            }
          ]
        }
      ]
    },
    {
      "id": "L1ERC20Gateway.sol#L1ERC20Gateway._token",
      "kind": "state-variable",
      "name": "_token",
      "path": "L1ERC20Gateway.sol",
      "line": null
    },
    {
      "id": "L1ERC20Gateway.sol#L1ERC20Gateway.onDropMessage",
      "kind": "function",
      "name": "onDropMessage",
      "path": "L1ERC20Gateway.sol",
      "line": 23,
      "visibility": "external",
      "is_entry_point": true,
      "modifiers": [],
      "guarded_by": [],
      "selector": "onDropMessage(address,uint256)",
      "reads_storage": [
        "_token"
      ],
      "writes_storage": [],
      "calls_internal": [],
      "calls_external": [
        "IERC20Upgradeable.safeTransfer"
      ],
      "delegatecalls": [],
      "guards": [],
      "uses": [
        {
          "line": 24,
          "concept_keys": [
            "amount"
          ],
          "kind": "param"
        },
        {
          "line": 24,
          "concept_keys": [
            "to"
          ],
          "kind": "param"
        },
        {
          "line": 25,
          "concept_keys": [
            "amount",
            "to"
          ],
          "kind": "emit"
        },
        {
          "line": 25,
          "concept_keys": [
            "amount"
          ],
          "kind": "param"
        },
        {
          "line": 25,
          "concept_keys": [
            "to"
          ],
          "kind": "param"
        }
      ]
    },
    {
      "id": "L1ReverseCustomGateway.sol#L1ReverseCustomGateway",
      "kind": "contract",
      "name": "L1ReverseCustomGateway",
      "path": "L1ReverseCustomGateway.sol",
      "line": 11,
      "contract_closure": [
        {
          "name": "_deposit",
          "defining_contract": "L1ReverseCustomGateway",
          "path": "L1ReverseCustomGateway.sol",
          "line": 12,
          "guards": [],
          "uses": [
            {
              "line": 13,
              "concept_keys": [
                "amount"
              ],
              "kind": "param"
            },
            {
              "line": 13,
              "concept_keys": [
                "msg",
                "msg:sender",
                "sender"
              ],
              "kind": "read"
            },
            {
              "line": 14,
              "concept_keys": [
                "amount"
              ],
              "kind": "param"
            }
          ]
        },
        {
          "name": "onDropMessage",
          "defining_contract": "L1ERC20Gateway",
          "path": "L1ERC20Gateway.sol",
          "line": 23,
          "guards": [],
          "uses": [
            {
              "line": 24,
              "concept_keys": [
                "amount"
              ],
              "kind": "param"
            },
            {
              "line": 24,
              "concept_keys": [
                "to"
              ],
              "kind": "param"
            },
            {
              "line": 25,
              "concept_keys": [
                "amount",
                "to"
              ],
              "kind": "emit"
            },
            {
              "line": 25,
              "concept_keys": [
                "amount"
              ],
              "kind": "param"
            },
            {
              "line": 25,
              "concept_keys": [
                "to"
              ],
              "kind": "param"
            }
          ]
        }
      ]
    },
    {
      "id": "L1ReverseCustomGateway.sol#L1ReverseCustomGateway._deposit",
      "kind": "function",
      "name": "_deposit",
      "path": "L1ReverseCustomGateway.sol",
      "line": 12,
      "visibility": "external",
      "is_entry_point": true,
      "modifiers": [],
      "guarded_by": [],
      "selector": "_deposit(address,uint256)",
      "reads_storage": [],
      "writes_storage": [],
      "calls_internal": [],
      "calls_external": [
        "IERC20Upgradeable.safeTransferFrom",
        "IMorphERC20Upgradeable.burn"
      ],
      "delegatecalls": [],
      "guards": [],
      "uses": [
        {
          "line": 13,
          "concept_keys": [
            "amount"
          ],
          "kind": "param"
        },
        {
          "line": 13,
          "concept_keys": [
            "msg",
            "msg:sender",
            "sender"
          ],
          "kind": "read"
        },
        {
          "line": 14,
          "concept_keys": [
            "amount"
          ],
          "kind": "param"
        }
      ]
    }
  ],
  "edges": [
    {
      "from": "L1ERC20Gateway.sol#L1ERC20Gateway.onDropMessage",
      "rel": "calls",
      "to": "*#IERC20Upgradeable.safeTransfer"
    },
    {
      "from": "L1ERC20Gateway.sol#L1ERC20Gateway",
      "rel": "extends-interface",
      "to": "L1ERC20Gateway.sol#L1ERC20Gateway.onDropMessage"
    },
    {
      "from": "L1ReverseCustomGateway.sol#L1ReverseCustomGateway",
      "rel": "inherits",
      "to": "*#L1ERC20Gateway"
    },
    {
      "from": "L1ReverseCustomGateway.sol#L1ReverseCustomGateway._deposit",
      "rel": "calls",
      "to": "*#IERC20Upgradeable.safeTransferFrom"
    },
    {
      "from": "L1ReverseCustomGateway.sol#L1ReverseCustomGateway._deposit",
      "rel": "calls",
      "to": "*#IMorphERC20Upgradeable.burn"
    },
    {
      "from": "L1ReverseCustomGateway.sol#L1ReverseCustomGateway",
      "rel": "extends-interface",
      "to": "L1ReverseCustomGateway.sol#L1ReverseCustomGateway._deposit"
    }
  ],
  "stats": {
    "solidity_files": 2,
    "other_files_listed": 0,
    "contracts": 4,
    "functions": 2,
    "state_variables": 1,
    "entry_points": 2,
    "external_call_edges": 4
  }
}
